{
  "name": "example-dark",
  "colors": {
    "bg": "#0F141D",
    "surface": "#171E29",
    "surfaceAlt": "#1D2633",
    "text": "#E8EDF5",
    "muted": "#93A0B4",
    "border": "#2A3546",
    "accent": "#F26B3A",
    "accentText": "#1A120E"
  },
  "radius": { "card": 18, "field": 10, "pill": 14, "gear": 22 },
  "spacing": { "page": 20, "section": 16, "label": 4 },
  "typography": { "body": 14, "small": 12, "title": 34, "family": "Segoe UI" },
  "motion": { "fast": 120, "normal": 200, "page": 280, "easing": "ease-out" }
}
